{
  "schemaVersion": 4,
  "artifactKind": "release-source-admission",
  "focusedSourceCommit": "77092392ce565f887c4698a3a12f384ea41b5e02",
  "admittedSourceCommit": "77092392ce565f887c4698a3a12f384ea41b5e02",
  "sourceClosurePolicy": {
    "fileName": "relevant-source-closure-v3.json",
    "sizeBytes": 3129,
    "sha256": "c7cd2e5ede4a96f6990145a4719912e6dd7dc97fa85d157ea0f68ab37af1e676"
  },
  "currentReleaseMatrix": {
    "fileName": "current-release-matrix-v2.json",
    "sizeBytes": 2450,
    "sha256": "32510b0dfd6493a0c6066d309c361555791b5ecc2a5b5ace72fdadc85a52eebb"
  },
  "ancestryVerified": true,
  "changedPaths": [],
  "changedPathsSha256": "4f53cda18c2baa0c0354bb5f9a3ecbe5ed12ab4d8e11ba873c2f11161202b945",
  "focusedQualificationSet": {
    "fileName": "focused-qualification-set-v3.json",
    "sizeBytes": 2215,
    "sha256": "e19cd853c4810f033ad619c38ed9b4288ab81b50cfc82731f33f31fb28aad8a7"
  },
  "branchCatalogProjection": {
    "fileName": "branch-catalog-projection-v3.json",
    "sizeBytes": 2401,
    "sha256": "50fd053cecda7e8a4bf393cfc36556fc21a128289b2111024f307d752c346d97"
  },
  "branchCatalogProjectionVerification": {
    "fileName": "branch-catalog-projection-verification-v3.json",
    "sizeBytes": 370,
    "sha256": "f6d9e6640a7f9c0d5b64af419eb7e545f2818b4c642eff2497492a9f2a89c44f"
  },
  "englishExecutionClosure": {
    "fileName": "english-profile-execution-closure-v2.json",
    "sizeBytes": 1454,
    "sha256": "cc21fac5b7ce1798ad0166aca0e29ce65c99007ffdea0ea5dfc8304f6f2f2299"
  },
  "chineseExecutionClosure": {
    "fileName": "chinese-profile-execution-closure-v2.json",
    "sizeBytes": 1426,
    "sha256": "86f06b69682e7755100b68ac91d285a22649e01ca4fed0bd5b77c85c525f1a75"
  },
  "profiles": [
    {
      "profileId": "english",
      "hostPackageId": "voice.host.english.mlx-whisper.darwin-arm64",
      "providerId": "autobyteus.voice.mlx-whisper-small",
      "modelAssetId": "voice.model.english.whisper-small-mlx-fp16.v1",
      "hostArchive": {
        "fileName": "voice-host-english-darwin-arm64-1.0.0.zip",
        "sizeBytes": 207494198,
        "sha256": "9d7d7b501229e85fc2ad54996f716d79eb59077a56c30ce3ce580c619fbcdc4a"
      },
      "hostDescriptorSha256": "e6b46a9445d2268f0d82deb506d0d7b993c4eca89aa163ffd16c0a364b202f2a",
      "hostFileManifestSha256": "b45187206bbfa7ded2d806c2605f8b186efa28dfb66dde860ca8f9f405bd5433",
      "modelAdmissionRootSha256": "7cbf9799670b42482a29404c7a2acfb3a7f701a5e890d3cc22f3245bddfb5448",
      "modelManifest": {
        "fileName": "voice-model-english-whisper-small-mlx-fp16-v1.json",
        "sizeBytes": 2335,
        "sha256": "623ad1e90eb305e703f09a15e2325be2026aa39dea98bb34f1859ac953836593"
      },
      "compatibilityPairSha256": "0271dd3cea86625add1bd88d9c8583f72229777e10d77070ecfa35f226d302ec",
      "focusedHostSourceClosure": {
        "sizeBytes": 43398,
        "sha256": "d900867c44ff9ef84cab88274558228e56333571d3ab890c8f5186ee0ef805ab"
      },
      "admittedHostSourceClosure": {
        "sizeBytes": 43398,
        "sha256": "d900867c44ff9ef84cab88274558228e56333571d3ab890c8f5186ee0ef805ab"
      },
      "equal": true
    },
    {
      "profileId": "chinese",
      "hostPackageId": "voice.host.chinese.funasr-native.darwin-arm64",
      "providerId": "autobyteus.voice.funasr-nano-q8",
      "modelAssetId": "voice.model.chinese.fun-asr-nano-gguf-q8.v1",
      "hostArchive": {
        "fileName": "voice-host-chinese-darwin-arm64-1.0.0.zip",
        "sizeBytes": 9663578,
        "sha256": "b12e5669de17b86299e5b7a3d078a85bea3ab396da33e38e291b3d239c8e63df"
      },
      "hostDescriptorSha256": "0cc487ac20aec67cdededce22d6f4660e3a7f7ac90f6ab5293443627865af960",
      "hostFileManifestSha256": "a6b979b1365cc6849b27402c830869bb884d185b25dec5fc7811148ef4b43a7a",
      "modelAdmissionRootSha256": "7a49df7e07d907818a02e3f5f12a58c47b5116d5e9deb2fd67caad1dcc97f0a8",
      "modelManifest": {
        "fileName": "voice-model-chinese-fun-asr-nano-gguf-q8-v1.json",
        "sizeBytes": 2801,
        "sha256": "09bf363a22ff7c98e53945e51544da09af0a96a7ad996b6ff991ef782a83c4da"
      },
      "compatibilityPairSha256": "44bdf379680c06a34610d09e0185544b84082120d41488f7698cd54b5eda75f8",
      "focusedHostSourceClosure": {
        "sizeBytes": 704820,
        "sha256": "4c68c31177a215a8c38237d820e5bf8057d8ab6eb50cfdcae106fbdc0fe6cc39"
      },
      "admittedHostSourceClosure": {
        "sizeBytes": 704820,
        "sha256": "4c68c31177a215a8c38237d820e5bf8057d8ab6eb50cfdcae106fbdc0fe6cc39"
      },
      "equal": true
    }
  ],
  "decision": "reuse-permitted"
}
